<?xml version="1.0" encoding="UTF-8"?>
<lemon:lemon-eater xmlns:lemon="lemon-schema/" xmlns:xsi="http://www.w3.org/2001/XMLSchema-instance" xsi:schemaLocation="lemon-schema/ ../lemon-schema.xsd "><name>Best empty level</name><data><id>1</id><dimension><width>80</width><height>30</height></dimension><skippable>false</skippable><layer><description><type>level</type><dimension><width>80</width><height>30</height></dimension><location><x>0</x><y>0</y></location><move><speed><x>0</x><y>0</y></speed><wrap>false</wrap><pause><start>0</start><end>0</end></pause></move><target>10</target></description><content><cell x="15" y="10">L</cell></content></layer></data></lemon:lemon-eater>