<?xml version="1.0" encoding="UTF-8"?>
<lemon:lemon-eater xmlns:lemon="lemon-schema/" xmlns:xsi="http://www.w3.org/2001/XMLSchema-instance" xsi:schemaLocation="lemon-schema/ lemon-schema.xsd "><name>Test Pack</name><data><id>intro</id><dimension><width>80</width><height>30</height></dimension><skippable>true</skippable><layer><description><type>background</type><dimension><width>160</width><height>45</height></dimension><location><x>0</x><y>0</y></location><move><speed><x>1</x><y>1</y></speed><wrap>true</wrap><pause><start>10</start><end>5</end></pause></move><target>0</target></description><content><cell x="15" y="15">f</cell><cell x="10" y="10">5</cell><cell x="150" y="40">d</cell></content></layer><layer><description><type>text</type><dimension><width>80</width><height>45</height></dimension><location><x>0</x><y>0</y></location><move><speed><x>0</x><y>1</y></speed><wrap>true</wrap><pause><start>5</start><end>5</end></pause></move><target>0</target></description><content><cell x="15" y="15">f</cell><cell x="10" y="10">5</cell><cell x="50" y="40">d</cell></content></layer></data><data><id>1</id><dimension><width>80</width><height>30</height></dimension><skippable>false</skippable><layer><description><type>background</type><dimension><width>160</width><height>45</height></dimension><location><x>0</x><y>0</y></location><move><speed><x>1</x><y>1</y></speed><wrap>true</wrap><pause><start>10</start><end>5</end></pause></move><target>0</target></description><content><cell x="15" y="15">f</cell><cell x="10" y="10">5</cell><cell x="150" y="40">d</cell></content></layer><layer><description><type>level</type><dimension><width>80</width><height>30</height></dimension><location><x>0</x><y>0</y></location><move><speed><x>0</x><y>0</y></speed><wrap>true</wrap><pause><start>0</start><end>0</end></pause></move><target>5</target></description><content><cell x="15" y="15">L</cell><cell x="10" y="10">5</cell><cell x="50" y="20">1</cell></content></layer><layer><description><type>text</type><dimension><width>80</width><height>45</height></dimension><location><x>0</x><y>0</y></location><move><speed><x>0</x><y>1</y></speed><wrap>true</wrap><pause><start>5</start><end>5</end></pause></move><target>0</target></description><content><cell x="15" y="15">f</cell><cell x="10" y="10">5</cell><cell x="50" y="40">d</cell></content></layer></data></lemon:lemon-eater>
